{
  "format_version": 2,
  "doc": "doll.psd",
  "size": [
    837,
    1731
  ],
  "pixels_per_unit": 1000.0,
  "layers": [
    {
      "kind": "polygon",
      "name": "brow.L",
      "path": "render_layers/brow.L.png",
      "position": [
        442,
        129
      ],
      "size": [
        49,
        15
      ],
      "z_order": 0
    },
    {
      "kind": "polygon",
      "name": "brow.R",
      "path": "render_layers/brow.R.png",
      "position": [
        346,
        129
      ],
      "size": [
        49,
        15
      ],
      "z_order": 1
    },
    {
      "kind": "polygon",
      "name": "eye.L",
      "path": "render_layers/eye.L.png",
      "position": [
        444,
        146
      ],
      "size": [
        30,
        25
      ],
      "z_order": 2
    },
    {
      "kind": "polygon",
      "name": "eye.R",
      "path": "render_layers/eye.R.png",
      "position": [
        365,
        146
      ],
      "size": [
        30,
        25
      ],
      "z_order": 3
    },
    {
      "kind": "polygon",
      "name": "arm.R",
      "path": "render_layers/arm.R.png",
      "position": [
        154,
        340
      ],
      "size": [
        145,
        254
      ],
      "z_order": 4
    },
    {
      "kind": "polygon",
      "name": "ear.L",
      "path": "render_layers/ear.L.png",
      "position": [
        494,
        139
      ],
      "size": [
        34,
        60
      ],
      "z_order": 5
    },
    {
      "kind": "polygon",
      "name": "belly",
      "path": "render_layers/belly.png",
      "position": [
        322,
        551
      ],
      "size": [
        193,
        190
      ],
      "z_order": 6
    },
    {
      "kind": "polygon",
      "name": "chest",
      "path": "render_layers/chest.png",
      "position": [
        298,
        292
      ],
      "size": [
        243,
        304
      ],
      "z_order": 7
    },
    {
      "kind": "polygon",
      "name": "ear.R",
      "path": "render_layers/ear.R.png",
      "position": [
        311,
        139
      ],
      "size": [
        34,
        60
      ],
      "z_order": 8
    },
    {
      "kind": "polygon",
      "name": "waist",
      "path": "render_layers/waist.png",
      "position": [
        292,
        656
      ],
      "size": [
        255,
        173
      ],
      "z_order": 9
    },
    {
      "kind": "polygon",
      "name": "head",
      "path": "render_layers/head.png",
      "position": [
        336,
        32
      ],
      "size": [
        166,
        245
      ],
      "z_order": 10
    },
    {
      "kind": "polygon",
      "name": "thigh.R",
      "path": "render_layers/thigh.R.png",
      "position": [
        244,
        785
      ],
      "size": [
        164,
        414
      ],
      "z_order": 11
    },
    {
      "kind": "polygon",
      "name": "thigh.L",
      "path": "render_layers/thigh.L.png",
      "position": [
        430,
        785
      ],
      "size": [
        164,
        414
      ],
      "z_order": 12
    },
    {
      "kind": "polygon",
      "name": "shin.R",
      "path": "render_layers/shin.R.png",
      "position": [
        265,
        1203
      ],
      "size": [
        101,
        393
      ],
      "z_order": 13
    },
    {
      "kind": "polygon",
      "name": "shin.L",
      "path": "render_layers/shin.L.png",
      "position": [
        473,
        1203
      ],
      "size": [
        101,
        393
      ],
      "z_order": 14
    },
    {
      "kind": "polygon",
      "name": "foot.R",
      "path": "render_layers/foot.R.png",
      "position": [
        214,
        1599
      ],
      "size": [
        124,
        100
      ],
      "z_order": 15
    },
    {
      "kind": "polygon",
      "name": "foot.L",
      "path": "render_layers/foot.L.png",
      "position": [
        501,
        1599
      ],
      "size": [
        124,
        100
      ],
      "z_order": 16
    },
    {
      "kind": "polygon",
      "name": "forearm.L",
      "path": "render_layers/forearm.L.png",
      "position": [
        626,
        587
      ],
      "size": [
        103,
        216
      ],
      "z_order": 17
    },
    {
      "kind": "polygon",
      "name": "forearm.R",
      "path": "render_layers/forearm.R.png",
      "position": [
        109,
        587
      ],
      "size": [
        103,
        216
      ],
      "z_order": 18
    },
    {
      "kind": "polygon",
      "name": "hand.L",
      "path": "render_layers/hand.L.png",
      "position": [
        670,
        794
      ],
      "size": [
        136,
        188
      ],
      "z_order": 19
    },
    {
      "kind": "polygon",
      "name": "hand.R",
      "path": "render_layers/hand.R.png",
      "position": [
        32,
        794
      ],
      "size": [
        136,
        188
      ],
      "z_order": 20
    },
    {
      "kind": "polygon",
      "name": "arm.L",
      "path": "render_layers/arm.L.png",
      "position": [
        539,
        340
      ],
      "size": [
        145,
        254
      ],
      "z_order": 21
    }
  ]
}
